"<ID|readonly|noverify>";"<English>";"<French>";"<Italian>";"<German>";"<Spanish>";"<Russian>";"<Ukrainian>";"<Polish>";"<Portuguese>";"<Turkish>";"<Czech>";"<Greek>";"<Indonesian>";"<Thai>";"<Korean>";"<Chinese>";"<Japanese>";"<TChinese>";"<Comments>";"<max_chars>"
"dm_viewer/mode/none";"Off";"Off";"Off";"Aus";"Desactivado";"Выкл.";"Вимк.";"Wył.";"Desativado";"Kapalı";"Vyp";"Off";"Nonaktif";"ปิด";"끔";"关\t闭";"オフ";"關";"Better as short as possible";
"dm_viewer/mode/armor";"Armor";"Blindage";"Corazza";"Panzerung";"Armadura";"Броня";"Броня";"Pancerz";"Blindagem";"Zırh";"Pancíř";"Θωράκιση";"Armor";"เกราะ";"장갑";"装\t甲";"装甲";"裝\t甲";"Better as short as possible";
"dm_viewer/mode/xray";"X-Ray";"Rayons-X";"Raggi X";"Röntgen";"Rayos X";"Рентген";"Рентген";"Wnętrze";"Raio-X";"X-Ray";"Rentgen";"Ακτίνες Χ";"Sinar-X";"เอ็กซ์เรย์";"내부";"内\t构";"X\t線";"内\t構";"Better as short as possible";
"mainmenu/btnProtectionAnalysis";"Protection Analysis";"Analyse de la protection";"Analisi della Protezione";"Schutzanalyse";"Análisis de Protección";"Анализ защищённости";"Аналіз захисту";"Analizy Osłony";"Análise de Proteção";"Koruma Analizi";"Analýza ochrany";"Protection Analysis";"Analisis Perlindungan";"Protection Analysis";"방어력 분석";"防\t护\t分\t析";"防護分析";"防\t護\t分\t析";;
"mainmenu/btnSimulation";"Simulation";"Simulation";"Simulazione";"Simulation";"Simulación";"Симуляция";"Моделювання";"Symulacja";"Simulação";"Simülasyon başlat";"Simulace";"Simulation";"Simulasi";"Simulation";"시험 사격";"模\t拟\t射\t击";"シミュレーション";"模\t擬\t射\t擊";"Label for a button which starts the shot simulation";
"protection_analysis/attacker";"Attacking vehicle and ammo";"Véhicule d'attaque et munitions";"Munizione e veicolo dell'attaccante";"Fahrzeug und Munition angreifen";"Vehículo atacante y munición";"Атакующая техника и снаряд";"Атакуюча техніка та боєприпаси";"Maszyna napastnika i amunicja";"Veículo e munições de ataque";"Mühimmata ve cephaneliğe saldırma";"Útočící stroj a munice";"Attacking vehicle and ammo";"Kendaraan penyerang dan amunisi";"Attacking vehicle and ammo";"공격 장비와 탄종";"攻\t击\t方\t载\t具\t与\t弹\t药";"攻撃車両および\t弾薬";"攻\t擊\t方\t載\t具\t與\t彈\t藥";;
"protection_analysis/result/not_penetrated";"Penetration not possible";"Pénétration impossible";"Penetrazione non possibile";"Kein Durchschlag möglich";"Penetración imposible";"Пробитие невозможно";"Проникнення неможливе";"Penetracja niemożliwa";"Sem penetração";"Delme mümkün değil";"nelze prorazit";"Penetration not possible";"Penetrasi tidak mungkin";"Penetration not possible";"관통 불가능";"无\t法\t击\t穿";"貫通不可";"無\t法\t擊\t穿";;
"protection_analysis/result/ineffective";"No damage of critical vehicle parts";"Pas de dégâts critiques du véhicule";"Nessun danno critico causato";"Kein Schaden an kritischen Fahrzeugkomponenten";"Sin daños a partes esenciales del vehículo";"Нет поражения критичных узлов машины";"При пошкодженні, не вважається критично важливою деталлю";"Brak uszkodzeń krytycznych elementów";"Sem danos críticos aos componentes do veículo";"Kritik araç parçalarında hasar yok";"bez kritického poškození vozidla";"No damage of critical vehicle parts";"Tidak ada damage terhadap bagian kendaraan kritis";"No damage of critical vehicle parts";"주요 부품 손상 없음";"未\t造\t成\t致\t命\t伤\t害";"兵器の\t重要部品に\t損傷なし";"未\t造\t成\t致\t命\t傷\t害";;
"protection_analysis/result/possible_effective";"Penetration possibility is low";"Probabilité de pénétration faible";"Bassa possibilità di penetrazione";"Geringe Durchschlagswahrscheinlichkeit";"Baja posibilidad de penetración";"Пробитие маловероятно";"Можливість проникнення низька";"Niskie prawdopodobieństwo penetracji";"Baixa possibilidade de penetração";"Delme olasılığı düşük";"nízká šance na průraz";"Penetration possibility is low";"Kemungkinan penetrasi rendah";"Penetration possibility is low";"관통 가능성 낮음";"击\t穿\t几\t率\t较\t低";"貫通可能性：\t低";"擊\t穿\t機\t率\t較\t低";;
"protection_analysis/result/effective";"Penetration is possible";"Pénétration possible";"Penetrazione possibile";"Durchschlag möglich";"Penetración posible";"Пробитие возможно";"Проникнення можливе";"Możliwa penetracja";"Penetração possível";"Delme mümkün";"šance na průraz";"Penetration is possible";"Penetrasi memungkinkan";"Penetration is possible";"관통 가능";"能\t够\t击\t穿";"貫通可能性：\t高";"可\t以\t擊\t穿";;
"protection_analysis/hint/headingAngle";"Heading angle";"Angle d'attaque";"Angolazione della mira";"Richtungswinkel";"Ángulo de impacto";"Курсовой угол";"Курсовий кут";"Kurs";"Ângulo de impacto";"Geliş açısı";"Směr pohybu";"Heading angle";"Sudut arah";"Heading angle";"입사각";"攻\t击\t方\t位\t角";"ヨー\t角";"航\t向\t角";;
"protection_analysis/hint/armor";"Equivalent protection against the specified ammo";"Protection équivalente contre la munition spécifiée";"Protezione equivalente contro la munizione specificata";"Panzerungsäquivalent gegen den gewählten Granatentyp";"Protección equivalente contra la munición especificada";"Эквивалент защиты от указанного боеприпаса";"Еквівалентний захист від зазначених боєприпасів";"Ekwiwalent osłony dla wybranej amunicji";"Proteção equivalente contra a munição especificada";"Seçilen mühimmata karşı eşdeğer koruma";"ekvivalentní ochrana proti vybrané munici";"Equivalent protection against the specified ammo";"Perlindungan yang setara terhadap amunisi tertentu";"Equivalent protection against the specified ammo";"해당 탄약에 대한 방어력";"对\t指\t定\t弹\t种\t的\t等\t效\t装\t甲\t厚\t度";"特定の\t弾薬に\t対抗し\t得る\t防御力";"對\t指\t定\t彈\t種\t的\t等\t效\t裝\t甲\t厚\t度";;
"protection_analysis/hint/ricochetProb";"Probability of ricochet";"Probabilité de ricochet";"Probabilità di rimbalzo";"Wahrscheinlichkeit für einen Abpraller";"Probabilidad de rebote";"Вероятность рикошета";"Імовірність рикошета";"Prawdopodobieństwo rykoszetu";"Probabilidade de ricochete";"Sekme olasılığı";"pravděpodobnost odrazu";"Probability of ricochet";"Kemungkinan memantul";"Probability of ricochet";"도탄 가능성";"跳\t弹\t几\t率";"跳弾確率";"跳\t彈\t機\t率";;
"protection_analysis/hint/parts/list";"Possible damage";"Dégâts possibles";"Danno possibile";"Möglicher Schaden";"Daño posible";"Вероятные повреждения";"Можливі пошкодження";"Możliwe uszkodzenia";"Danos possíveis";"Olası hasar";"možné poškození";"Possible damage";"Kemungkinan damage";"Possible damage";"피해를 줄 수 있는 부분";"预\t期\t伤\t害";"損傷する\t可能性";"預\t計\t傷\t害";;
"armor_class/no_armoring/common";"There is no armor protection on this vehicle.";"Il n'y a pas de blindage sur ce véhicule.";"Non c'è nessuna corazzatura su questa unità.";"Dieses Fahrzeug verfügt über keine Panzerung.";"No hay protección de blindaje en este vehículo.";"На данной технике отсутствует бронирование.";"На цій техніці відсутнє бронювання.";"Ta maszyna nie posiada pancerza ochronnego.";"Não há proteção de blindagem neste veículo.";"Bu araçta zırh koruması yoktur.";"Tento stroj nemá žádné pancéřování";"Το όχημα αυτό δεν διαθέτει προστασία θωράκισης.";"Tidak ada perlindungan armor di kendaraan ini.";"ไม่มีการหุ้มเกราะป้องกันบนพาหนะนี้";"이 장비에는 장갑이 없습니다.";"该\t载\t具\t没\t有\t任\t何\t装\t甲\t防\t护。";"この\t兵器には\t装甲がありません。";"載\t具\t不\t具\t備\t任\t何\t裝\t甲\t防\t護。";;
"armor_class/thickness";"Thickness";"Épaisseur";"Spessore";"Panzerungsstärke";"Grosor";"Толщина";"Товщина";"Grubość";"Espessura";"Kalınlık";"Tloušťka";"Thickness";"Ketebalan";"ความหนา";"방호력";"厚\t度";"厚さ";"厚\t度";;
"armor_class/effective_thickness";"Effective thickness";"Épaisseur effective";"Spessore effettivo";"Effektive Panzerungsstärke";"Grosor efectivo";"Приведённая толщина";"Ефективна товщина";"Grubość efektywna";"Espessura efetiva";"Etkili kalınlık";"Efektivní tloušťka";"Effective thickness";"Ketebalan efektif";"ความหนาที่มีประสิทธิภาพ";"유효 방호력";"等\t效\t厚\t度";"実質的な\t厚さ";"等\t效\t厚\t度";;
"armor_class/impact_angle";"Impact angle";"Angle d'impact";"Angolo d'impatto";"Einschlagswinkel";"Ángulo de impacto";"Угол встречи";"Кут зіткнення";"Kąt uderzenia";"Ângulo de impacto";"Etki açısı";"Úhel dopadu";"Impact angle";"Sudut benturan";"มุมกระทบ";"착탄각";"入\t射\t角";"弾着角";"入\t射\t角";;
"armor_class/normal_angle";"Constructional armor slope angle";"Angle d'inclinaison du blindage";"Angolo inclinazione corazza";"Konstruktionsbedingter Neigungswinkel der Panzerung";"Ángulo de inclinación del blindaje estructural";"Конструктивный угол наклона брони";"Конструктивний кут нахилу броні";"Konstrukcyjny kąt nachylenia pancerza";"Ângulo de inclinação da armadura de construção";"Yapısal zırh eğim açısı";"Konstrukční úhel sklonu pancíře";"Γωνία κλίσης θωράκισης του κατασκευαστή";"Sudut kemiringan armor konstruksi";"มุมลาดเอียงโครงเกราะ";"장갑 경사각";"垂\t直\t倾\t角：";"装甲の\t傾斜角度";"垂\t直\t傾\t角";;
"armor_class/variable_thickness_armor";"Variable thickness armor";"Armure à épaisseur variable";"Corazza a spessore variabile";"Variable Panzerungsdicke";"Blindaje de espesor variable";"Броня переменной толщины";"Броня змінної товщини";"Zmienna grubość pancerza";"Blindagem de espessura variável";"Değişken kalınlıkta zırh";"Různá šířka pancíře";"Θωράκιση μεταβλητού πάχους";"Armor ketebalan variabel";"เกราะหนาไม่สม่ำเสมอ";"가변 두께 장갑";"可\t变\t厚\t度\t装\t甲";"装甲の\t厚さの\t変数";"可\t變\t厚\t度\t實\t體\t裝\t甲";;
"armor_class/armor_dimensions_at_point";"Armor dimensions at point";"Épaisseur du blindage à cet angle";"Spessore corazza nel punto";"Panzerungsmaße an der Stelle";"Dimensiones de blindaje en el punto";"Габарит бронирования в указанной точке";"Розмір бронювання в зазначеній точці";"Wymiary pancerza w punkcie";"Dimensões da blindagem no ponto";"Noktadaki zırh ölçüleri";"Rozměry pancíře v bodě";"Διαστάσεις θωράκισης στο σημείο";"Dimensi armor pada titik";"ขนาดเกราะ ณ ตำแหน่ง";"해당 각도에서의 장갑 두께";"该\t处\t装\t甲\t参\t数";"側面毎の\t装甲面積";"該\t處\t裝\t甲\t參\t數";;
"armor_class/driver";"Driver";"Pilote";"Pilota";"Fahrer";"Conductor";"Водитель";"Водій";"Kierowca";"Piloto";"Sürücü";"Řidič";"Driver";"Pengemudi";"คนขับ";"조종수";"驾\t驶\t员";"操縦手";"駕\t駛\t員";;
"armor_class/machine_gunner";"Machine gunner";"Mitrailleur";"Mitragliere";"MG-Schütze";"Ametrallador";"Стрелок-радист";"Кулеметник";"Operator KM-u";"Metralhador";"Makineli tüfekçi";"Kulometčík";"Machine gunner";"Penembak senapan mesin";"พลปืนกล";"전방사수";"机\t枪\t手";"機銃手";"機\t槍\t手";;
"armor_class/loader";"Loader";"Chargeur";"Servente";"Ladeschütze";"Cargador";"Заряжающий";"Зарядник";"Ładowniczy";"Carregador";"Yükleyici";"Nabíječ";"Loader";"Pengisi amunisi";"พลบรรจุกระสุน";"탄약수";"装\t填\t手";"装填手";"裝\t填\t手";;
"armor_class/commander";"Commander";"Commandant";"Comandante";"Kommandant";"Comandante";"Командир";"Командир";"Dowódca";"Comandante";"Komutan";"Velitel";"Commander";"Komandan";"ผู้บังคับบัญชา";"전차장";"车\t长";"車長";"車\t長";;
"armor_class/gunner";"Gunner";"Tireur";"Artigliere";"Richtschütze";"Artillero";"Наводчик";"Навідник";"Celowniczy";"Artilheiro";"Nişancı";"Střelec";"Gunner";"Penembak";"มือปืน";"포수";"炮\t手";"砲手";"炮\t手";;
"armor_class/gunner_aircraft";"Gunner";"Mitrailleur";"Mitragliere";"Richtschütze";"Artillero";"Стрелок";"Навідник";"Strzelec";"Artilheiro";"Nişancı";"Střelec";"Gunner";"Penembak";"มือปืน";"사수";"机\t枪\t手";"銃手";"機\t槍\t手";;
"armor_class/gunner_tank";"Gunner";"Tireur";"Artigliere";"Richtschütze";"Artillero";"Наводчик";"Навідник";"Celowniczy";"Artilheiro";"Nişancı";"Střelec";"Gunner";"Penembak";"มือปืน";"포수";"炮\t手";"砲手";"炮\t手";;
"armor_class/optic";"Optics";"Optiques";"Ottiche";"Optik";"Ópticas";"Оптика";"Оптика";"Optyka";"Ótica";"Optikler";"Optika";"Optics";"Optik";"อุปกรณ์เล็ง";"광학장비";"观\t瞄\t设\t备";"照準器";"觀\t瞄\t設\t備";;
"armor_class/optic_gun";"Gunner optics";"Optiques du tireur";"Ottica del Cannoniere";"Richtschützen-Zieleinrichtung";"Ópticas de artillero";"Оптика наводчика";"Оптика навідника";"Optyka strzelca";"Ótica do Artilheiro";"Nişancı optikleri";"Optika střelce";"Gunner optics";"Optik penembak";"ออปติกส์สำหรับพลปืน";"포수 광학장비";"炮\t手\t瞄\t准\t镜";"砲手照準器";"炮\t手\t觀\t瞄";;
"armor_class/commander_panoramic_sight";"Commander optics";"Optiques du commandant";"Ottiche Capocarro";"Kommandanten-Zieleinrichtung";"Ópticas del comandante";"Оптика командира";"Оптика командира";"Optyka dowódcy";"Ótica do Comandante";"Komutan optikleri";"Optika velitele";"Commander optics";"Optik komandan";"ออปติกส์สำหรับผู้บังคับบัญชา";"전차장 광학장비";"车\t长\t观\t瞄\t设\t备";"車長用照準器";"車\t長\t觀\t瞄";;
"armor_class/drive_turret_h";"Horizontal aiming drive";"Mécanisme de rotation";"Puntamento orizzontale";"Horizontaler Richtantrieb";"Mecanismo de puntería horizontal";"Привод горизонтального наведения";"Привід горизонтального наведення";"Mechanizm obrotowy wieży";"Acionamento horizontal da torre";"Yatay taret mekanizması";"Vodorovný posuv";"Horizontal aiming drive";"Penggerak bidik horizontal";"ระบบขับเคลื่อนการเล็งแนวนอน";"선회장치";"方\t向\t机";"砲塔旋回装置";"方\t向\t機";;
"armor_class/drive_turret_v";"Vertical aiming drive";"Mécanisme d'élévation";"Puntamento verticale";"Vertikaler Richtantrieb";"Mecanismo de puntería vertical";"Привод вертикального наведения";"Привід вертикального наведення";"Mechanizm podniesieniowy działa";"Acionamento vertical da torre";"Dikey taret mekanizması";"Svislý posun";"Vertical aiming drive";"Penggerak bidik vertikal";"ระบบขับเคลื่อนการเล็งแนวตั้ง";"고저장치";"高\t低\t机";"砲昇降装置";"高\t低\t機";;
"armor_class/cannon_breech";"Cannon breech";"Culasse";"Culatta del cannone";"Geschützverschluss";"Recámara del cañón";"Казённая часть орудия";"Казенна частина гармати";"Zamek działa";"Culatra de canhão";"Top kundağı";"Závěr děla";"Cannon breech";"Pangkal meriam";"ช่องปืนใหญ่";"약실";"炮\t闩";"砲閉鎖機";"炮\t閂";;
"armor_class/fuel_tank";"Fuel tank";"Réservoir de carburant";"Serbatoio";"Treibstofftank";"Tanque de combustible";"Топливный бак";"Паливний бак";"Zbiornik paliwa";"Tanque de combustível";"Yakıt tankı";"Palivová nádrž";"Fuel tank";"Tangki bahan bakar";"ถังเชื้อเพลิง";"연료탱크";"油\t箱";"燃料\tタンク";"油\t箱";;
"armor_class/fuel_tank_exterior";"Exterior fuel tank";"Réservoir de carburant externe";"Serbatoio di carburante esterno";"Äußerer Treibstofftank";"Tanque de combustible externo";"Внешний топливный бак";"Зовнішній паливний бак";"Zewnętrzny zbiornik paliwa";"Tanque de combustível externo";"Dış yakıt tankı";"Vnější palivová nádrž";"Exterior fuel tank";"Tangki bahan bakar eksterior";"ถังน้ำมันภายนอก";"외부 연료탱크";"外\t部\t油\t箱";"外部燃料\tタンク";"外\t部\t油\t箱";;
"armor_class/ammo";"Ammo";"Munitions";"Munizioni";"Munition";"Munición";"Боеприпасы";"Боєзапас";"Amunicja";"Munição";"Cephane";"Munice";"Ammo";"Amunisi";"กระสุน";"탄약";"弹\t药";"弾薬";"彈\t藥";;
"armor_class/ammo_charges";"Charges";"Charges";"Cariche";"Ladungen";"Cargas";"Заряды";"Заряди";"Ładunki";"Cargas";"Başlıklar";"Nálože";"Charges";"Peledak";"การจ่ายกระสุน";"장약";"发\t射\t药";"装填";"發\t射\t藥";;
"armor_class/radiator";"Radiator";"Radiateur";"Radiatore";"Kühler";"Radiador";"Радиатор";"Радіатор";"Chłodnica";"Radiador";"Radyatör";"Chladič";"Radiator";"Radiator";"หม้อน้ำ";"라디에이터";"散\t热\t器";"ラジエーター";"散\t熱\t器";;
"armor_class/radio_station";"Radio station";"Poste radio";"Stazione radio";"Funkausrüstung";"Puesto de radio";"Радиостанция";"Радіостанція";"Radiostacja";"Estação de rádio";"Telsiz";"Vysílačka";"Radio station";"Stasiun radio";"สถานีวิทยุ";"무전기";"电\t台";"無線";"電\t台";;
"armor_class/engine";"Engine";"Moteur";"Motore";"Motor";"Motor";"Двигатель";"Двигун";"Silnik";"Motor";"Motor";"Motor";"Engine";"Mesin";"เครื่องยนต์";"엔진";"发\t动\t机";"エンジン";"引\t擎";;
"armor_class/transmission";"Transmission";"Transmission";"Trasmissione";"Getriebe";"Transmisión";"Трансмиссия";"Трансмісія";"Przekładnia";"Transmissão";"Şanzıman";"Převodovka";"Transmission";"Transmisi";"ระบบส่งกำลัง";"변속기";"传\t动\t机\t构";"変速機";"傳\t動\t裝\t置";;
"armor_class/fire_control_system";"FCS";"Système de conduite de tir";"SAI";"FCS";"FCS";"СУО";"Система керування вогнем";"SKO";"Sistema de controlo de tiro";"AKS";"FCS";"FCS";"FCS";"FCS";"FCS";"火\t控\t系\t统";"FCS";"火\t控\t系\t統";;
"armor_class/desc/fire_control_system";"Provides for the operation of the module:
{partsList}";"Permet aux modules suivants de fonctionner:
{partsList}";"Permette l'operatività del modulo:
{partsList}";"Ermöglicht die Nutzung des Moduls:
{partsList}";"Permite el funcionamiento del módulo:
{partsList}";"Обеспечивает работу модулей:
{partsList}";"Забезпечує роботу модулів:
{partsList}";"Zapewnia funkcjonowania modułów:
{partsList}";"Fornece a operação do módulo:
{partsList}";"Modülün işlerini yapar: 
{partsList}";"Zajišťuje provoz modulu:
{partsList}";"Provides for the operation of the module:
{partsList}";"Menyediakan pengoperasian modul:
{partsList}";"Provides for the operation of the module:
{partsList}";"다음 모듈이 작동할 수 있게 합니다:
{partsList}";"火\t控\t系\t统\t损\t毁\t后，\t下\t列\t设\t备\t将\t无\t法\t正\t常\t运\t作：
{partsList}";"下記\tモジュールの\t操作が\t可能となります：\t
 {partsList}";"確\t保\t下\t列\t設\t備\t正\t常\t運\t作：
{partsList}";;
"armor_class/power_system";"Power system";"Système d'alimentation";"Sistema di alimentazione";"Energieversorgung";"Sistema de alimentación";"Электросистема";"Система живлення";"System zasilania";"Sistema de alimentação";"Güç sistemi";"Napájecí systém";"Power system";"Sistem daya";"ระบบพลังงาน";"동력 계통";"供\t电\t系\t统";"電力\tシステム";"供\t電\t系\t統";;
"armor_class/driver_controls";"Driver controls";"Commandes du pilote";"Controlli di guida";"Fahrersteuerung";"Controles del conductor";"Органы управления";"Система керування водія";"Układ sterowania kierowcy";"Controlos do piloto";"Sürüş kontrolleri";"Řídící prvky";"Driver controls";"Kontrol pengemudi";"การควบคุมของผู้ขับขี่";"조종 계통";"驾\t驶\t操\t纵\t装\t置";"操縦手の\t操作";"駕\t駛\t裝\t置";;
"armor_class/desc/driver_controls";"Controls and indicators of the battle vehicle movement control,
in case of failure block the possibility of movement until field repair.";"Les commandes et indicateurs permettant le contrôle du véhicule,
en cas de défaillance, rend le déplacement impossible jusqu'à ce qu'elles soient réparées.";"Controlli ed indicatori del veicolo da battaglia,
in caso di guasto, blocca la possibilità di muoversi fino a riparazioni ultimate.";"Bedienelemente und Anzeigen für die Bewegungssteuerung des Kampffahrzeugs,
blockieren im Falle eines Ausfalls die Möglichkeit der Bewegung bis zur Feldreparatur.";"Controles e indicadores del control de movimiento del vehículo de combate,
en caso de avería bloquean la posibilidad de movimiento hasta su reparación sobre el terreno.";"Органы управления и индикаторы управления движением боевой машины,
при выходе из строя блокируют возможность движения до проведения полевого ремонта.";"Органи керування та індикатори керування рухом бойової машини, при виході з ладу блокують можливість рухатись до проведення польового ремонту.";"Kontrolki i wskaźniki sterujące ruchem maszyny,
w wypadku awarii, blokuje możliwość poruszania się
aż do czasu naprawy.";"Controles e indicadores do movimento do veículo, em caso de falha trava o movimento até o reparo.";"Savaş aracı hareket kontrolü işaretçileri ve kontrol cihazları,
bloğun bozulması durumunda saha onarımı bitene kadar araç hareket edemez.";"Ovládací prvky řízení pohybu bojového vozidla,
v případě poruchy blokují možnost pohybu až do opravy v terénu.";"Controls and indicators of the battle vehicle movement control,
in case of failure block the possibility of movement until field repair.";"Kontrol dan indikator pengendalian pergerakan kendaraan tempur.
Jika terjadi kegagalan, akan memblokir kemungkinan pergerakan hingga mendapatkan perbaikan lapangan.";"Controls and indicators of the battle vehicle movement control,
in case of failure block the possibility of movement until field repair.";"장비의 이동 방향을 조종할 수 있게 하는 장비입니다.
이 모듈이 손상되었을 경우, 수리 전까지 이동할 수 없게 됩니다.";"包\t括\t控\t制\t载\t具\t行\t驶\t的\t操\t纵\t装\t置\t与\t仪\t表\t盘，
一\t旦\t遭\t到\t损\t毁，\t载\t具\t在\t修\t复\t工\t作\t完\t成\t前\t都\t将\t无\t法\t行\t动。";"戦闘車両の\t移動制御における\t操縦系統と\t方向指示器。\t
故障した\t場合、\t野戦修理が\t完了するまで\t移動不能になります。";"包\t括\t控\t制\t載\t具\t行\t駛\t的\t操\t縱\t裝\t置\t與\t儀\t錶\t板，
一\t旦\t遭\t到\t損\t毀，\t載\t具\t在\t修\t復\t工\t作\t完\t成\t前\t將\t無\t法\t行\t動。";;
"armor_class/autoloader";"Autoloader";"Chargeur automatique";"Caricatore automatico";"Autolader";"Cargador automático";"Автомат заряжания";"Автозавантажувач";"Automat ładujący";"Carregador automático";"Otomatik yükleyici";"Autonabíječ";"Autoloader";"Pengisi amunisi otomatis";"เครื่องบรรจุกระสุนอัตโนมัติ";"자동장전장치";"装\t弹\t机";"オートローダー";"自\t動\t裝\t彈\t機";;
